{
  "main": {
    "name": "Электромагнитная торпедная катапульта",
    "type": "Стартовые площадки",
    "category": "Катапульты",
    "class": "SubgridLauncherModule",

    "size": 1,
    "position": "external",
    "tags": ["catapult", "subgrid"]
  },
  "activation": "active",
  "cycle": 1,
  "reload": 5,

  "interference": 0,

  "launcher": {
    "vector": [0, 120],
    "headingOffset": 0,
    "subgrid": {
      "class": "SubgridObject",
      "dataRef": "Torpedo T"
    }
  },

  "modificators": {
    "offline": [],
    "online": [
      {
        "target": "this",
        "characteristic": "constant.capacitor.generation",
        "modificationType": "number",
        "modificator": -5,
        "isAffectedByInterference": false
      }
    ],
    "active": [
      {
        "target": "this",
        "characteristic": "constant.capacitor.generation",
        "modificationType": "number",
        "modificator": -15,
        "isAffectedByInterference": false
      }
    ],
    "overload": []
  }
}